[I 2026-08-17 20:22:25,026] Trial 17 finished with value: 8.031311 and parameters: {'batch': 8735, 'u_batch': 5240, 'threads': 21, 'gpu_layers': 76, 'flash_attn': 0, 'override_tensor': 'ffn_cpu_odd'}. Best is trial 5 with value: 27.141891.
[I 2026-08-17 20:23:14,565] Trial 18 finished with value: 8.039492 and parameters: {'batch': 4252, 'u_batch': 5686, 'threads': 11, 'gpu_layers': 120, 'flash_attn': 0, 'override_tensor': 'ffn_cpu_even'}. Best is trial 5 with value: 27.141891.
[I 2026-08-17 20:24:04,361] Trial 19 finished with value: 8.004683 and parameters: {'batch': 12494, 'u_batch': 7777, 'threads': 22, 'gpu_layers': 63, 'flash_attn': 0, 'override_tensor': 'ffn_cpu_last_quarter'}. Best is trial 5 with value: 27.141891.
[I 2026-08-17 20:24:53,964] Trial 20 finished with value: 8.02331 and parameters: {'batch': 1497, 'u_batch': 2039, 'threads': 19, 'gpu_layers': 107, 'flash_attn': 0, 'override_tensor': 'ffn_cpu_odd'}. Best is trial 5 with value: 27.141891.
[I 2026-08-17 20:25:15,672] Trial 21 finished with value: 19.207086 and parameters: {'batch': 1340, 'u_batch': 5789, 'threads': 23, 'gpu_layers': 30, 'flash_attn': 0, 'override_tensor': 'ffn_cpu_down'}. Best is trial 5 with value: 27.141891.
[I 2026-08-17 20:26:05,232] Trial 22 finished with value: 8.040449 and parameters: {'batch': 1824, 'u_batch': 5870, 'threads': 23, 'gpu_layers': 54, 'flash_attn': 0, 'override_tensor': 'ffn_cpu_from_6'}. Best is trial 5 with value: 27.141891.
[I 2026-08-17 20:26:54,861] Trial 23 finished with value: 8.033278 and parameters: {'batch': 1036, 'u_batch': 7996, 'threads': 22, 'gpu_layers': 51, 'flash_attn': 0, 'override_tensor': 'ffn_cpu_odd'}. Best is trial 5 with value: 27.141891.
[I 2026-08-17 20:27:44,356] Trial 24 finished with value: 8.063421 and parameters: {'batch': 3704, 'u_batch': 5348, 'threads': 23, 'gpu_layers': 66, 'flash_attn': 0, 'override_tensor': 'ffn_cpu_down'}. Best is trial 5 with value: 27.141891.
[I 2026-08-17 20:28:10,866] Trial 25 finished with value: 15.564622 and parameters: {'batch': 2950, 'u_batch': 7878, 'threads': 17, 'gpu_layers': 26, 'flash_attn': 1, 'override_tensor': 'ffn_cpu_even'}. Best is trial 5 with value: 27.141891.
[I 2026-08-17 20:28:59,085] Trial 26 finished with value: 8.344235 and parameters: {'batch': 5914, 'u_batch': 6944, 'threads': 13, 'gpu_layers': 10, 'flash_attn': 0, 'override_tensor': 'ffn_cpu_odd'}. Best is trial 5 with value: 27.141891.
[I 2026-08-17 20:29:49,801] Trial 27 finished with value: 7.94166 and parameters: {'batch': 2985, 'u_batch': 4823, 'threads': 22, 'gpu_layers': 9, 'flash_attn': 0, 'override_tensor': 'ffn_cpu_last_quarter'}. Best is trial 5 with value: 27.141891.
[I 2026-08-17 20:30:44,883] Trial 28 finished with value: 7.302078 and parameters: {'batch': 3825, 'u_batch': 7596, 'threads': 17, 'gpu_layers': 5, 'flash_attn': 0, 'override_tensor': 'ffn_cpu_updown'}. Best is trial 5 with value: 27.141891.
[I 2026-08-17 20:31:34,555] Trial 29 finished with value: 8.024313 and parameters: {'batch': 13817, 'u_batch': 638, 'threads': 19, 'gpu_layers': 73, 'flash_attn': 0, 'override_tensor': 'ffn_cpu_down'}. Best is trial 5 with value: 27.141891.
[I 2026-08-17 20:32:24,532] Trial 30 finished with value: 7.972755 and parameters: {'batch': 8341, 'u_batch': 7457, 'threads': 16, 'gpu_layers': 46, 'flash_attn': 0, 'override_tensor': 'ffn_cpu_down'}. Best is trial 5 with value: 27.141891.
[I 2026-08-17 20:33:06,349] Trial 31 finished with value: 9.591129 and parameters: {'batch': 3021, 'u_batch': 6652, 'threads': 10, 'gpu_layers': 38, 'flash_attn': 1, 'override_tensor': 'ffn_cpu_even'}. Best is trial 5 with value: 27.141891.
[I 2026-08-17 20:33:51,096] Trial 32 finished with value: 9.017392 and parameters: {'batch': 685, 'u_batch': 8020, 'threads': 20, 'gpu_layers': 13, 'flash_attn': 1, 'override_tensor': 'ffn_cpu_last_quarter'}. Best is trial 5 with value: 27.141891.
[I 2026-08-17 20:34:44,839] Trial 33 finished with value: 7.4885 and parameters: {'batch': 4806, 'u_batch': 7467, 'threads': 18, 'gpu_layers': 6, 'flash_attn': 1, 'override_tensor': 'ffn_cpu_even'}. Best is trial 5 with value: 27.141891.
[I 2026-08-17 20:35:04,696] Trial 34 finished with value: 21.136816 and parameters: {'batch': 994, 'u_batch': 2641, 'threads': 21, 'gpu_layers': 31, 'flash_attn': 0, 'override_tensor': 'ffn_cpu_down'}. Best is trial 5 with value: 27.141891.
[I 2026-08-17 20:35:29,769] Trial 35 finished with value: 16.421524 and parameters: {'batch': 4126, 'u_batch': 579, 'threads': 23, 'gpu_layers': 28, 'flash_attn': 0, 'override_tensor': 'ffn_cpu_down'}. Best is trial 5 with value: 27.141891.
[I 2026-08-17 20:35:48,379] Trial 36 finished with value: 22.723116 and parameters: {'batch': 1923, 'u_batch': 713, 'threads': 23, 'gpu_layers': 32, 'flash_attn': 0, 'override_tensor': 'ffn_cpu_down'}. Best is trial 5 with value: 27.141891.
[I 2026-08-17 20:36:11,346] Trial 37 finished with value: 18.043953 and parameters: {'batch': 623, 'u_batch': 1631, 'threads': 18, 'gpu_layers': 29, 'flash_attn': 0, 'override_tensor': 'ffn_cpu_odd'}. Best is trial 5 with value: 27.141891.
[I 2026-08-17 20:37:00,864] Trial 38 finished with value: 8.049177 and parameters: {'batch': 124, 'u_batch': 183, 'threads': 24, 'gpu_layers': 39, 'flash_attn': 0, 'override_tensor': 'ffn_cpu_even'}. Best is trial 5 with value: 27.141891.
[I 2026-08-17 20:37:50,137] Trial 39 finished with value: 8.080844 and parameters: {'batch': 1217, 'u_batch': 3605, 'threads': 15, 'gpu_layers': 43, 'flash_attn': 0, 'override_tensor': 'ffn_cpu_down'}. Best is trial 5 with value: 27.141891.
[I 2026-08-17 20:38:39,663] Trial 40 finished with value: 8.040032 and parameters: {'batch': 4582, 'u_batch': 989, 'threads': 22, 'gpu_layers': 61, 'flash_attn': 0, 'override_tensor': 'ffn_cpu_from_6'}. Best is trial 5 with value: 27.141891.
[I 2026-08-17 20:39:29,787] Trial 41 finished with value: 7.970598 and parameters: {'batch': 593, 'u_batch': 1608, 'threads': 12, 'gpu_layers': 43, 'flash_attn': 0, 'override_tensor': 'ffn_cpu_odd'}. Best is trial 5 with value: 27.141891.
[I 2026-08-17 20:40:30,497] Trial 42 finished with value: 6.605198 and parameters: {'batch': 3614, 'u_batch': 2964, 'threads': 24, 'gpu_layers': 2, 'flash_attn': 0, 'override_tensor': 'ffn_cpu_odd'}. Best is trial 5 with value: 27.141891.
[I 2026-08-17 20:41:09,859] Trial 43 finished with value: 10.333536 and parameters: {'batch': 4008, 'u_batch': 1218, 'threads': 15, 'gpu_layers': 17, 'flash_attn': 0, 'override_tensor': 'ffn_cpu_up'}. Best is trial 5 with value: 27.141891.
[I 2026-08-17 20:42:06,973] Trial 44 finished with value: 7.030861 and parameters: {'batch': 550, 'u_batch': 2608, 'threads': 13, 'gpu_layers': 3, 'flash_attn': 0, 'override_tensor': 'ffn_cpu_from_6'}. Best is trial 5 with value: 27.141891.
[I 2026-08-17 20:42:49,327] Trial 45 finished with value: 9.485697 and parameters: {'batch': 36, 'u_batch': 4711, 'threads': 22, 'gpu_layers': 43, 'flash_attn': 1, 'override_tensor': 'ffn_cpu_down'}. Best is trial 5 with value: 27.141891.
[I 2026-08-17 20:43:30,819] Trial 46 finished with value: 9.694485 and parameters: {'batch': 3699, 'u_batch': 1070, 'threads': 18, 'gpu_layers': 57, 'flash_attn': 1, 'override_tensor': 'ffn_cpu_down'}. Best is trial 5 with value: 27.141891.
[I 2026-08-17 20:44:25,608] Trial 47 finished with value: 7.323933 and parameters: {'batch': 2342, 'u_batch': 776, 'threads': 20, 'gpu_layers': 5, 'flash_attn': 1, 'override_tensor': 'ffn_cpu_odd'}. Best is trial 5 with value: 27.141891.
[I 2026-08-17 20:45:15,576] Trial 48 finished with value: 7.980142 and parameters: {'batch': 2119, 'u_batch': 2834, 'threads': 24, 'gpu_layers': 40, 'flash_attn': 0, 'override_tensor': 'ffn_cpu_down'}. Best is trial 5 with value: 27.141891.
[I 2026-08-17 20:45:40,929] Trial 49 finished with value: 16.268947 and parameters: {'batch': 811, 'u_batch': 4318, 'threads': 19, 'gpu_layers': 27, 'flash_attn': 0, 'override_tensor': 'ffn_cpu_all'}. Best is trial 5 with value: 27.141891.
[I 2026-08-17 20:46:09,569] Trial 50 finished with value: 14.326201 and parameters: {'batch': 1013, 'u_batch': 1797, 'threads': 20, 'gpu_layers': 25, 'flash_attn': 0, 'override_tensor': 'ffn_cpu_last_quarter'}. Best is trial 5 with value: 27.141891.
[I 2026-08-17 20:47:00,274] Trial 51 finished with value: 7.868273 and parameters: {'batch': 226, 'u_batch': 54, 'threads': 23, 'gpu_layers': 88, 'flash_attn': 0, 'override_tensor': 'ffn_cpu_down'}. Best is trial 5 with value: 27.141891.
[I 2026-08-17 20:47:43,999] Trial 52 finished with value: 9.248753 and parameters: {'batch': 5745, 'u_batch': 704, 'threads': 18, 'gpu_layers': 14, 'flash_attn': 0, 'override_tensor': 'ffn_cpu_down'}. Best is trial 5 with value: 27.141891.
[I 2026-08-17 20:48:33,404] Trial 53 finished with value: 8.061315 and parameters: {'batch': 2623, 'u_batch': 618, 'threads': 21, 'gpu_layers': 43, 'flash_attn': 0, 'override_tensor': 'ffn_cpu_down'}. Best is trial 5 with value: 27.141891.
[I 2026-08-17 20:48:53,287] Trial 54 finished with value: 21.124246 and parameters: {'batch': 1349, 'u_batch': 6169, 'threads': 20, 'gpu_layers': 31, 'flash_attn': 0, 'override_tensor': 'ffn_cpu_up'}. Best is trial 5 with value: 27.141891.
[I 2026-08-17 20:49:50,459] Trial 55 finished with value: 7.005482 and parameters: {'batch': 2073, 'u_batch': 5862, 'threads': 22, 'gpu_layers': 4, 'flash_attn': 0, 'override_tensor': 'ffn_cpu_up'}. Best is trial 5 with value: 27.141891.
[I 2026-08-17 20:50:40,003] Trial 56 finished with value: 8.057036 and parameters: {'batch': 2206, 'u_batch': 6915, 'threads': 20, 'gpu_layers': 44, 'flash_attn': 0, 'override_tensor': 'none'}. Best is trial 5 with value: 27.141891.
[I 2026-08-17 20:51:29,869] Trial 57 finished with value: 7.998568 and parameters: {'batch': 2793, 'u_batch': 5336, 'threads': 19, 'gpu_layers': 58, 'flash_attn': 0, 'override_tensor': 'ffn_cpu_up'}. Best is trial 5 with value: 27.141891.
[I 2026-08-17 20:52:23,406] Trial 58 finished with value: 7.508218 and parameters: {'batch': 235, 'u_batch': 1959, 'threads': 23, 'gpu_layers': 7, 'flash_attn': 0, 'override_tensor': 'ffn_cpu_updown'}. Best is trial 5 with value: 27.141891.
[I 2026-08-17 20:53:13,147] Trial 59 finished with value: 8.018431 and parameters: {'batch': 14415, 'u_batch': 3739, 'threads': 12, 'gpu_layers': 124, 'flash_attn': 0, 'override_tensor': 'ffn_cpu_all'}. Best is trial 5 with value: 27.141891.
[I 2026-08-17 20:53:54,976] Trial 60 finished with value: 9.660574 and parameters: {'batch': 318, 'u_batch': 5954, 'threads': 24, 'gpu_layers': 18, 'flash_attn': 0, 'override_tensor': 'ffn_cpu_odd'}. Best is trial 5 with value: 27.141891.
[I 2026-08-17 20:54:44,592] Trial 61 finished with value: 8.054259 and parameters: {'batch': 671, 'u_batch': 5264, 'threads': 23, 'gpu_layers': 65, 'flash_attn': 0, 'override_tensor': 'ffn_cpu_even'}. Best is trial 5 with value: 27.141891.
[I 2026-08-17 20:55:24,099] Trial 62 finished with value: 10.224078 and parameters: {'batch': 808, 'u_batch': 1973, 'threads': 19, 'gpu_layers': 19, 'flash_attn': 0, 'override_tensor': 'none'}. Best is trial 5 with value: 27.141891.
[I 2026-08-17 20:56:08,313] Trial 63 finished with value: 9.136198 and parameters: {'batch': 3795, 'u_batch': 181, 'threads': 23, 'gpu_layers': 16, 'flash_attn': 0, 'override_tensor': 'ffn_cpu_down'}. Best is trial 5 with value: 27.141891.
[I 2026-08-17 20:56:50,049] Trial 64 finished with value: 9.612723 and parameters: {'batch': 10615, 'u_batch': 2372, 'threads': 5, 'gpu_layers': 137, 'flash_attn': 1, 'override_tensor': 'ffn_cpu_last_quarter'}. Best is trial 5 with value: 27.141891.
[I 2026-08-17 20:57:20,329] Trial 65 finished with value: 13.520144 and parameters: {'batch': 778, 'u_batch': 596, 'threads': 21, 'gpu_layers': 24, 'flash_attn': 0, 'override_tensor': 'ffn_cpu_odd'}. Best is trial 5 with value: 27.141891.
[I 2026-08-17 20:58:01,990] Trial 66 finished with value: 9.633065 and parameters: {'batch': 654, 'u_batch': 6681, 'threads': 18, 'gpu_layers': 71, 'flash_attn': 1, 'override_tensor': 'ffn_cpu_up'}. Best is trial 5 with value: 27.141891.
[I 2026-08-17 20:58:51,684] Trial 67 finished with value: 8.023739 and parameters: {'batch': 3363, 'u_batch': 1345, 'threads': 19, 'gpu_layers': 53, 'flash_attn': 0, 'override_tensor': 'ffn_cpu_all'}. Best is trial 5 with value: 27.141891.
[I 2026-08-17 20:59:41,234] Trial 68 finished with value: 8.055845 and parameters: {'batch': 6742, 'u_batch': 5510, 'threads': 1, 'gpu_layers': 143, 'flash_attn': 0, 'override_tensor': 'ffn_cpu_from_6'}. Best is trial 5 with value: 27.141891.
[I 2026-08-17 21:00:30,612] Trial 69 finished with value: 8.065544 and parameters: {'batch': 9595, 'u_batch': 1341, 'threads': 22, 'gpu_layers': 60, 'flash_attn': 0, 'override_tensor': 'none'}. Best is trial 5 with value: 27.141891.
Traceback (most recent call last):
  File "<frozen runpy>", line 198, in _run_module_as_main
  File "<frozen runpy>", line 88, in _run_code
  File "E:\local_AI\interference\.venv\Scripts\llama-optimus.exe\__main__.py", line 10, in <module>
  File "E:\local_AI\interference\.venv\Lib\site-packages\llama_optimus\cli.py", line 171, in main
    run_optimization(n_trials=args.trials, n_tokens=args.n_tokens, metric=args.metric,
    ^^^^^^^^^^^^^^^^^^^^^^^^^^^^^^^^^^^^^^^^^^^^^^^^^^^^^^^^^^^^^^^^^^^^^^^^^^^^^^^^^^
  File "E:\local_AI\interference\.venv\Lib\site-packages\llama_optimus\core.py", line 538, in run_optimization
    subprocess.run(shlex.split(llama_bench_cmd), check=True)
  File "C:\Users\LANG\AppData\Roaming\uv\python\cpython-3.12-windows-x86_64-none\Lib\subprocess.py", line 548, in run
    with Popen(*popenargs, **kwargs) as process:
         ^^^^^^^^^^^^^^^^^^^^^^^^^^^
  File "C:\Users\LANG\AppData\Roaming\uv\python\cpython-3.12-windows-x86_64-none\Lib\subprocess.py", line 1026, in __init__
    self._execute_child(args, executable, preexec_fn, close_fds,
  File "C:\Users\LANG\AppData\Roaming\uv\python\cpython-3.12-windows-x86_64-none\Lib\subprocess.py", line 1538, in _execute_child
    hp, ht, pid, tid = _winapi.CreateProcess(executable, args,
                       ^^^^^^^^^^^^^^^^^^^^^^^^^^^^^^^^^^^^^^^
FileNotFoundError: [WinError 2] 系统找不到指定的文件。
